{
  "version": 1,
  "tool": {
    "id": "seo-gap-images",
    "version": "1.0",
    "official_sources": []
  },
  "run": {
    "approval_class": "external_read",
    "command_intent": "Run the images SEO gap check.",
    "command_redacted": "python3 .agents/tools/seo/gap-check.py --mode images --target <redacted>",
    "started_at": "2026-07-29T00:41:32.642952+00:00",
    "completed_at": "2026-07-29T00:41:32.852127+00:00"
  },
  "scope": {
    "mode": "images",
    "client_or_project": null,
    "targets": [
      "https://www.afistfullofdollars.com/"
    ],
    "market": null,
    "date_range": null
  },
  "data_status": "complete",
  "artifacts": [
    {
      "path": "reviews/evidence/seo/2026-07-28-afistfullofdollars-site-audit/raw/gap-images/input.txt",
      "kind": "raw-input",
      "description": "Local or fetched source inspected by the gap checker."
    },
    {
      "path": "reviews/evidence/seo/2026-07-28-afistfullofdollars-site-audit/raw/gap-images/run-metadata.json",
      "kind": "run-metadata",
      "description": "Target, approval class, timing, and errors."
    }
  ],
  "limits": [
    "Input is capped at 10 MiB.",
    "Checks are structural evidence and heuristics, not ranking or compliance guarantees.",
    "No schema generation or external mutation is performed."
  ],
  "findings": [
    {
      "id": "images-empty-alt",
      "severity": "low",
      "evidence_label": "observed-page",
      "summary": "2 image elements use an empty alt attribute; this may be intentional for decorative images.",
      "source_ref": "https://www.afistfullofdollars.com/",
      "recommendation": null
    },
    {
      "id": "images-missing-dimensions",
      "severity": "low",
      "evidence_label": "observed-page",
      "summary": "7 image elements omit width or height attributes; layout impact was not measured.",
      "source_ref": "https://www.afistfullofdollars.com/",
      "recommendation": null
    },
    {
      "id": "images-inventory",
      "severity": "info",
      "evidence_label": "observed-page",
      "summary": "Observed 9 image elements.",
      "source_ref": "https://www.afistfullofdollars.com/",
      "recommendation": null
    }
  ],
  "verification": [
    "Input source and check mode are recorded.",
    "Raw input and run metadata were preserved when the source could be read.",
    "Run seo-quality-gate before treating findings as ready."
  ]
}
