{
  "version": 1,
  "tool": {
    "id": "seo-gap-schema",
    "version": "1.0",
    "official_sources": []
  },
  "run": {
    "approval_class": "external_read",
    "command_intent": "Run the schema SEO gap check.",
    "command_redacted": "python3 .agents/tools/seo/gap-check.py --mode schema --target <redacted>",
    "started_at": "2026-07-29T00:41:33.152617+00:00",
    "completed_at": "2026-07-29T00:41:33.280602+00:00"
  },
  "scope": {
    "mode": "schema",
    "client_or_project": null,
    "targets": [
      "https://www.afistfullofdollars.com/"
    ],
    "market": null,
    "date_range": null
  },
  "data_status": "complete",
  "artifacts": [
    {
      "path": "reviews/evidence/seo/2026-07-28-afistfullofdollars-site-audit/raw/gap-schema/input.txt",
      "kind": "raw-input",
      "description": "Local or fetched source inspected by the gap checker."
    },
    {
      "path": "reviews/evidence/seo/2026-07-28-afistfullofdollars-site-audit/raw/gap-schema/run-metadata.json",
      "kind": "run-metadata",
      "description": "Target, approval class, timing, and errors."
    }
  ],
  "limits": [
    "Input is capped at 10 MiB.",
    "Checks are structural evidence and heuristics, not ranking or compliance guarantees.",
    "No schema generation or external mutation is performed."
  ],
  "findings": [
    {
      "id": "schema-jsonld-parsed",
      "severity": "info",
      "evidence_label": "observed-page",
      "summary": "Parsed 3 JSON-LD scripts; observed types: Organization, WebSite.",
      "source_ref": "https://www.afistfullofdollars.com/",
      "recommendation": null
    }
  ],
  "verification": [
    "Input source and check mode are recorded.",
    "Raw input and run metadata were preserved when the source could be read.",
    "Run seo-quality-gate before treating findings as ready."
  ]
}
